{
  "schema_version": 1,
  "compiled_from": "797b648bb580dd78888ff5c38d4bd0aa425d1f1a",
  "status": "complete",
  "compiled_at": "2026-10-03T07:38:45Z",
  "attempts": 1,
  "workflow_run_url": "https://github.com/langchain-samples/openwiki-insurance-corpus/actions/runs/37106989843",
  "claims": {
    "total": 1094,
    "added": 0,
    "retracted": 0,
    "carried": 1094
  },
  "changed_sources": []
}
